date,title,text,rating,visitor_origin,visit
Erlebnisdatum: Oktober 2018,Fußball in bester Gesellschaft,"Ein Fußballspiel in der Allianz Arena ist ein Erlebnis.Der tolle Stadionbau, die Archtektur sind sehr sehenswert.Unbedingt eine Stadionführung buchen , man kommt sogar in den Kabinentralt und in den Spielertunnel.Anreise zu Spielen unbedingt mit öffentlichen Verkehrsmitteln durchführen.Es gibt zwar ein großes Parkhaus, aber nach dem Spiel dauert es unfassbar lange mit der Ausfahrt.",50,"Bad Homburg, Deutschland",Reiseart: geschäftlich
Erlebnisdatum: Februar 2019,"Ein richtiges ""Wohnzimmer""","Immer wieder ein Erlebnis. Der große Vorteil gegenüber anderen Fussballstadien ist, dass man getrost auch mit Familie und Kindern hingehen kann. Halt friedlich und trotzdem Atmosphäre.",50,,Reiseart: als Paar
Erlebnisdatum: Februar 2019,sehr sehenswert,"eine tolle architektur, tolle akustik, ein muß für jeden münchenbesucher, und die krönung der fc bayern hat gewonnen",50,"Füssen, Deutschland",Reiseart: mit der Familie
Erlebnisdatum: Februar 2019,Das erste mal im Stadion ,Super Stimmung im Stadion auch von aussen sieht das Stadion super aus man sieht die Allianz Arena schon von weitem wen man mit der S-Bahn kommt,50,"Winkel, Schweiz",Reiseart: mit Freunden
Erlebnisdatum: Februar 2019,Sehenswert ,"Die Heimstätte des FC Bayern ist schon einmal sehenswert, allein was die Architektur betrifft. Auch die Erreichbarkeit mit öffentlichen Verkehrsmitteln ist gut organisiert, obwohl das Stadion im Münchener Norden liegt.",40,,Reiseart: mit Freunden
Erlebnisdatum: Januar 2019,Tolles Fussballstadion,"Tolles Stadion, steile Ränge, man sieht von jedem Platz aus. Bequeme Sitze, große Anzeigentafel. Kostenloses WLAN, guter Empfang",50,"Kornwestheim, Deutschland",Reiseart: mit Freunden
Erlebnisdatum: Januar 2019,75.000 Menschen und kein Stress. ,"Die Arena ist ein Muß für alle Fans und Fußball begeisterte. Moderate Preise, Atmosphäre und viele Tore, beim Besuch eines Spiels, machen das Erlebnis perfekt.",50,,Reiseart: als Paar
Erlebnisdatum: August 2018,"Immer wieder schön ,egal ob Erlebniswelt oder zum Spiel","Habe bis jetzt nur positive Erfahrungen gemacht ,das einzige was etwas stört ist ,dass es zu den oberen Rängen nur über die Treppen kommt ,für ältere oder auch Gehbehinderte sehr beschwerlich ! Ansonsten Daumen hoch!",50,,
Erlebnisdatum: Januar 2019,Ein must have seen für FC Bayern Fans!,"Wir waren zur Besichtigung der Allianz Arena mit Erlebniswelt hier. Die ca ein stündige informative Führung durch das Stadion und den Mannschaftkabinen, war für unser Sohn, Fußballer und FC Bayern Fan ein Highlight auf der Münchentour. Deshalb empfehlen wir das Ausflugsziel sehr gerne weiter!",50,"Queidersbach, Deutschland",Reiseart: mit der Familie
Erlebnisdatum: Januar 2019,Tolle Einblicke auch für Nicht-Fans,"Wir haben das Stadion als Familie besucht und das obwohl wir alle keine Fußball Fans sind. Zunächst haben wir eine 1 stündige Führung durch das Stadion gebucht und danach die ""Erlebniswelt"" besucht. Die Führung war kurzweilig und sehr informativ. Die Erlebniswelt zeichnet eindrucksvoll die Historie des Clubs nach. Audioguides sind verfügbar und gut gemacht. Alles in allem eine tolle Erfahrung. Auch für Nicht-Fans!",50,"Frankfurt am Main, Deutschland",Reiseart: mit der Familie
Erlebnisdatum: Januar 2019,Beeindruckend ,"Wir sind regelmässig in der Allianz Arena. Hier passt alles. Nicht vergessen, man kann nur mit Arena Karte bezahlen. Einziges Mabko: Parken!",50,"Nürnberg, Deutschland",Reiseart: mit Freunden
Erlebnisdatum: Dezember 2018,sehr Beeindruckend,"Auch ls nicht Fussballfan ist es eigentlich ein Muss dieses Stadion zu besuchen. Unsere Gruppe war begeistert. Die Tour haben wir im Voraus, online gebucht.",50,,Reiseart: als Paar
Erlebnisdatum: Dezember 2018,Tolles Stadion,"Sehr informative und nahezu leidenschaftliche Führung. Sollte man erleben. Iczh wusste nicht, dass die Außenhülle des Stadions aus aufgeblasenen Luftzellen besteht......",50,,Reiseart: mit der Familie
