date,title,text,rating,visitor_origin,visit
Erlebnisdatum: Dezember 2014,sehr gute Verkehrsanbindung,um Besichtigungen und Innenstadtbesuche zu starten ist Garching TOP gelegen. Mit U6 sind alle Knotgen gut erreichbar.Der Stadionbesuch lohnt sich immer,50,"Arnsberg, Deutschland",Reiseart: mit Freunden
,Sehenswert!,"An einem regnerischen Tag haben wir die Gelegenheit genutzt und uns die FCB-ERLEBNISWELT angesehen.Der Eintrittspreis ist in Ordnung, es gibt ja auch viel zu sehen.Die Kosten für den Parkplatz (5 €) könnten aber billiger angeboten werden.Man erfährt sehr viel über die Geschichte des Vereins und kann zahlreiche Trophäen vesichtigen.",50,"München, Deutschland",
Erlebnisdatum: August 2014,Einfach genial,Wer sich für den Verein begeistern möcht oder schon macht sollte dieses geniale Ambiente erleben und genieße.  Pokale satt und vieles mehr.,50,"Frechen, Deutschland",Reiseart: mit der Familie
Erlebnisdatum: Februar 2015,Einmalig!! Ein Muss für alle Bayern-Fans!!,"Die Geschichte des FC Bayern von 1900 bis zur Gegenwart!! Wunderbares Vereinsmuseum, für das man Zeit mitbringen muss. Pokale, Geschichten, Anekdoten; wer einmal da war, kommt wieder!!!",50,"Koblenz, Deutschland",Reiseart: als Paar
,Für Bayern Fans ein Muss,"Da kommt kein Bayern Fan daran vorbei.  Liebevoll gestaltet, die ganze Geschichte des FCB.   Für Kinder interessant, besonders die Fotoecke.Danach noch zum Imbiss. Rin schöner Ausflug fur Regentage.",40,"München, Deutschland",
Erlebnisdatum: April 2015,Bayern Museum,Ausstellung des FC Bayern mit vielen extras wie Fotomöglichkeit mit Spielern in Lebensgröße und kleinem Kino.,30,"Groß-Zimmern, Deutschland",Reiseart: mit der Familie
Erlebnisdatum: Januar 2015,Alles über den Rekordmeister ....auf keinen Fall verpassen.,"Die FCB-Erlebniswelt hat viel zu bieten. Um möglichst viel mitzunehmen, sollte man sich unbedingt mit Audioguide (plus drei Euro) auf den Weg machen. Mein Tipp: Wer genug Zeit hat, sollte die Kombi-Tour inkl. Allianz Arena buchen.",50,"München, Deutschland",Reiseart: mit der Familie
Erlebnisdatum: Januar 2015,Stern des Südens,"Einzigartige Präsentation, beeindruckende Beweise einer jahrzentelangen Erfolgsgeschichte. Der FC Bayern ist auch hier eine Klasse für sich.",50,"Hückelhoven, Deutschland",Reiseart: geschäftlich
Erlebnisdatum: April 2014,Absoluter Hammer,"am Anfang war ich etwas skeptisch was die Erlebniswelt betrifft aber ich wurde eines besseren belehrt. Super aufgebaut, tolle Ausstellungen und die Erklärungen vor Ort waren für jeden Bayern oder auch nicht Bayernfan lehrreich. Als wir vor Ort waren, war auch noch die Sepp Maier Sonderausstellung. Sehr kurzweilig mit tollen Anekdoten von Sepp. Die Pokalsammlung ist sehr imposant. Die virtuelle Gesprächsrunde der Ex-Profis ist sehr unterhaltsam und toll aufgebaut. Man kann einfach sagen, das es für jeden Fußballfan besonders für Bayernfans ein absolutes Muss ist, wenn man in München ist. Am besten verbindet es mit der Führung durch die Allianz Arena welche ebenfalls Klasse ist.",50,,Reiseart: als Paar
Erlebnisdatum: März 2014,Staunen,"Für jeden Bayern - Fan ein muß und selbst bei den mitgereisten Gänsehaut garantiert. Bereits am Eingang strahlende Augen, jeder schritt durch die Ausstellung bleibende Eindrücke. Soviel Neues, noch nicht gesehenes .....",50,"Einbeck, Deutschland",Reiseart: als Paar
Erlebnisdatum: Januar 2015,auch als Nicht-Bayernfan einen Besuch wert,"Interessante Geschichten und Fakten rund um den Verein und seine Spieler.Am Ende gint es die ganze Manschaft in LEbensgröße zu sehen, sehr lustig und gut für Fotos.Nur wie man seine Jacken aus den Gaderoben vor dem Eingang bekommt, wenn man am anderen Ende doch zum Ausgang ruas muss, darauf muss amn vor allem kurz vor 18:00 Uhr achten, da der Eingang zu den Gaderoben ausenrum dann abgeschlossen wird.",40,"Frankfurt am Main, Deutschland",Reiseart: mit Freunden
Erlebnisdatum: Juli 2014,Ein Muss für jede Bayern- und auch Fußballfan,"Wer sich für Fußball interessiert (oder gar FC Bayern-Fan ist) sollte sich auf jeden Fall die Zeit nehmen und die FCB-Erlebniswelt besuchen.Hier erhält man einen Einblick in die gesamte Vereinsgeschichte von den Anfängen bis heute.So lassen sich unter anderem sämtliche Meisterschalen und DFB-Pokale bewundern.Wer noch etwas mehr Zeit hat, kann auch ein Kombiticket erstehen und den Besuch der Erlebniswelt gleich mit einer Stadionbesichtigung verbinden.Kleiner Hinweis: An Spieltagen (Heimspiele) kann beides meines Wissens nicht besucht werden!",50,"München, Deutschland",Reiseart: mit Freunden
Erlebnisdatum: November 2014,Pflichtbesuch !,"Für jeden FCB-Fan unbedingt empfehlenswert. Abwechslungsreiches Angebot (Selfies schießen, Foto mit (Holz)Spielern, alle Pokale, Meisterschalen. Es gibt auch interessante Videos über Sepp Maier, diverse Spitzenspiele und für die Kinder einen gläsernen Fußballkäfig. Die Geschichte des FCB ist ausführlich dokumentiert. (Zu empfehlen für zu Hause. Die Bücher ""Der FCB und seine Juden"" und ""FC Bayern München-Unser Verein-Unsere Geschichte"".Das angeschlossene Megastore ist ein Paradies für alle die den FCB lieben.",50,"Baden, Niederosterreich, Austria",Reiseart: mit der Familie
,Ein Hammer! ,Fc Bayern Welten ist ein Muss. Der Besuch ist für Groß und Klein! Eine Pflicht für jeden Bayernfan. Sehr informativ und sehr beeindruckend. Die ganzen Pokale zu sehen ist ein Traum!,50,"Limburg, Deutschland",
Erlebnisdatum: August 2014,Must see,"Absolut empfehlenswert ist der Besuch der Erlebniswelt. Hier wird die Geschichte und die unzähligen Erfolge des FC Bayern dargestellt. Die Erlebniswelt ist chronologisch aufgebaut. Das Highlight ist sicherlich die Pokalsammlung aus 2013 mit dem Triple, Supercup und Weltpokal.",50,"Baden-Baden, Deutschland",Reiseart: mit der Familie
,Gänsehaut pur,Die FC Bayern Erlebniswelt ist für Groß und klein was. Schade dass es etwas überteuert ist aber der Eintritt lohnt sich auf alle Fälle. Schade auch das man von der Erlebniswelt nicht aufs Spielfeld oder in die Arena rein schauen kann.,40,"Herzogenaurach, Deutschland",
Erlebnisdatum: August 2013,Für jeden Fußball-Fan interessant!,Im Anschluß nach einer informativen und ebenfalls sehenswerten Führung durch die ALLIANZ-Arena waren wir anschließend noch in der Erlebniswelt.Die Ausstellung ist modern gestaltet und zeigt die Gründung bis zur letzten Saison des FC.Interessant ist die umfangreiche Pokale-Sammlung und die Trikots von Beginn bis zur Neuzeit. An einigen Spielen kann man sein fußballerisches Geschick testen.Auch für den Nicht-FC Bayern-Fan -wie mein Enkel- sehenswert und informativ.,50,"München, Deutschland",Reiseart: mit der Familie
Erlebnisdatum: August 2013,Erinnerungen werden wach,"Da wir knapp 3 Stunden wegen großen Andrangs auf die Arenatour warten mussten, konnten wir uns ausgiebig in der Erlebniswelt umschauen. Chronologisch sehr schön geordnet. Meisterschalen, Pokale, Trikots alles wird präsentiert. Sehr interessant die interaktive Darstellung vom Bau und der Geschichte der Arena, von der wir uns anschließend ein Bild machen konnten. Man versteht einiges viel besser. Fotos wurden reichlich von den aktuellen Spielern aus Aluminium geschossen oder auch den Sternen der erfolgreichsten Bayernspielern.Auch an die Jüngsten mit Spielemöglichkeiten wurde gedacht.Natürlich kommt man beim Verlassen der Erlebniswelt nicht drum rum, im Shop mit unzähligen Fanartikeln vorbei zu schauen.Dann gingen wir in den Biergarten und warteten bei Speis und Trank auf den Tourbeginn.",50,"Zwickau, Deutschland",Reiseart: mit der Familie
Erlebnisdatum: November 2012,Lässt das Fanherz höher schlagen,"Im Rahmen einer geführten Arena-Tour besichtigten wir auch die Erlebniswelt. Von der Gründung bis zur aktuellen Saison wird dem Besucher hier interaktiv und modern die Geschichte des FC Bayern erzählt. Es gibt viele Filmausschnitte zu sehen und man kann bei einigen Spielen sein fußballerisches Geschick unter Beweis stellen. Besonders gefallen hat uns die Ausstellung der Pokale und Trikots, die Höhepunkte der Vereinsgeschichte und natürlich die lebensgroße Darstellung der Spieler der aktuellen Mannschaft. Hier lassen sich dann auch schöne Erinnerungsfotos schießen. Der riesige Shop mit allen erdenklichen Fanartikeln rundet den Besuch perfekt ab.Ein Muss für jeden Bayern-Fan und solche die es werden wollen.",50,,Reiseart: mit Freunden
Erlebnisdatum: Januar 2013,Ein Muss für den Bayern-Fan,"Die Geschichte vom FCB von Anfang an - inklusive vielen Filmausschnitten, ""Torwand""schießen, interaktivem Quiz, einer Trikotausstellung usw. Ein echtes Erlebnis. Tipp: wir waren an einem Dienstag außerhalb der Ferien, kein Spieltag - da waren wir (fast) die einzigen Besucher, kein Gedränge!",50,"Salzburg, Österreich",Reiseart: als Paar
Erlebnisdatum: Juli 2013,Selbstbeweihräucherung zum Höchstpreis,"Wir hatten uns sehr auf den Arena-Besuch gefreut. Allerdings muss man mal locker 1-2 Stunden warten, bis man zur gefühtrten Tour durch die Arena antreten darf. Da wir nicht den halben Tag in dem Komplex verbringen wollten, entschieden wir uns dann nur für die ""tolle"" Erlebniswelt zum Schnäppchenpreis von NUR 12,- pro Person. Nach einer halben Stunde, umgeben von einigen errungenen Pokalen, vielen Bayerntrikots, wahrscheinlich aller bisheriger Bayernspieler mit Namen und Bild sowie der aktuellen Bayernspieler aus Pappe und in Lebensgröße verließen wir nach ca. 35 Minuten sehr enttäuscht die Erlebniswelt in Richtung Ausgang,  wo auf geschätzten 5000 qm wohl das Wichtigste wartete....., nämlich der FC-Bayern-Shop, um dem Fan dann entgültig das letzte Geld aus der Tasche zu ziehen..... Wir verließen sehr enttäuscht das Arena-Gelände. Schade FC-Bayern, hätte gedacht, ihr verdient euer Geld auf andere Art und Weise und nicht an euren Fans und Symphatisanten!!",20,"Lauf, Deutschland",Reiseart: als Paar
Erlebnisdatum: November 2012,Mehr als ich erwartet hatte,"Die Erlebniswelt hat unserer Familie sehr gut gefallen, das Museum ist modern, interaktiv und spannend gestaltet. Jeder, auch der nicht-totale-Bayern-Fan, wird hier gut unterhalten. Das Personal war sehr freundlich und hilfsbereit. Wir hatten auch die Stadiontour gebucht und die Kombination ist dann das Rundum-Erlebnis mit vielen Einblicken, die man sonst nicht bekommt und Hintergrundwissen zum Stadion und zum FC Bayern bzw. 1860.",40,"München, Deutschland",Reiseart: als Paar
Erlebnisdatum: September 2012,das Museum das keines sein möchte,"Von Paul Breitner wurden ich anlässlich eines Preisausschreibens durch die dieses Jahr eröffnete Erlebniswelt geführt. Auch als nicht Bayern Fan ist es absolut sehenswert und vorallem nicht ein Ort der an ein ""verstaubtes Museum"" erinnert.",50,"Kaiserslautern, Deutschland",Reiseart: als Paar
Erlebnisdatum: September 2012,Ein tolles Fussballmuseum !,"Die FC Bayern Erlebniswelt kann sich meiner Meinung nach defintiv mit dem ebenfalls tollem Fussballmuseum in Barcelona messen, ja es toppt es sogar. Die Erlebniswelt ist chronologisch aufgebaut mit Vitrinen voll von Tickets, Trikots, Bälle, also jegliche Art Erinnerungen. Als Highlights stechen sicherlich die Tonne, in die ""Klinsi "" getreten hatte, die Trophäensammlung und die aktuellere Exponate, wie die Torschützenkönigkanone von Mario Gomez, heraus. Es folgt ein Film, der schöne und nicht so schöne Szenen aus der Klubgeschichte zeigt mit Statements von ehemaligen und aktuellen Spielern, was der FC Bayern persönlich für sie bedeutet. Im hinteren Bereich befindet sich ein kleiner Bereich für Kinder, die aktuelle Mannschaft als lebensgrossen Pappfiguren, die Hall of Fame mit den legendärsten Spielern und ein Bereich mit den skurillsten Fanartikel und Erinnerungsstücken des FC Bayern. Man sollte für den Besuch zirka 2 Stunden einrechnen um sich in Ruhe alles anzusehen und verinnerlichen. Nach dem Besuch der Erlebniswelt wurde mir aufs Neuste bewusst, dass der FC Bayern München nicht nur irgendein Verein ist, sondern ein ganz Besonderer Verein ist.",50,"Christnach, Luxemburg",Reiseart: mit Freunden
Erlebnisdatum: Februar 2020,Auf jeden Fall einen Besuch wert,"Das Bayern-Münchner Stadion ist an sich schon sehr beeindruckend, und auch das Museum in ihm ist einen Besuch wert. Die Exponate sind sehr vielfältig und sowohl in Englisch als auch in Deutsch so leicht zu verfolgen. Der Zugang ist an Spieltagen etwas schwierig, aber wir haben es trotzdem geschafft.",40,"Hythe, Vereinigtes Königreich",Reiseart: mit der Familie
