date,title,text,rating,visitor_origin,visit
Erlebnisdatum: November 2019,Einfach nur Klasse ,Eines der besten Vereinsmusen in Europa. Nicht nur interessant für Bayern München Fans. Top in der Darstellung und sehr gut erklärt.,50,"Köln, Deutschland",
Erlebnisdatum: August 2019,Eines der besten Vereinsmuseen ,Sehr modernes und schönes Vereinsmuseum. Nicht nur aber vor allem für Bayern Fans ein muss. Auch nach Spielschluss geöffnet.,50,"Zülpich, Deutschland",
Erlebnisdatum: März 2019,Als Bayern Fan ein Muss.,"Die Erlebniswelt ist einfach Super. Mit allen Pokalen vom Fc Bayern München, bis zur Geschicht der Erstehung usw.  Man sollte ambesten schon viel zeit einplanen, wenn man alles genau beobachten möchte :) ",50,,
Erlebnisdatum: Mai 2019,Lässt Fußballer-Herzen einfach höher schlagen,"Toll gestaltete Ausstellung, die auch für Nicht-Fußballbegeisterte beeindruckend ist. Alles mit viel Liebe gestaltet und abwechslungsreich. Empfehlenswert ist auch eine Stadionführung!",50,,
Erlebnisdatum: April 2019,auch für nicht FC Bayern Fans ein Erlebnis!!!,ich bin wegen meinem Sohn zu der Allianz Arena... ich muss sagen wenn mich Fussball  auch nicht so interessiert war die Erlebnis Tour jeden Cent wert!!! Das Museum ist wirklich super aufgebaut und die Geschichte ist richtig spannend und die ganzen Exponate alles super liebevoll,50,,
Erlebnisdatum: April 2019,Riesige Ausstellung,"Hier sieht man alles was den FC Bayern ausmacht. Beeindruckend die Pokale aber auch die vielen Videos. Die empfohlenen 1,5 Stunden für die Besichtigung reichen kaum aus",50,"Hinterzarten, Deutschland",
Erlebnisdatum: April 2019,Tolles Erlebnis ,Wir haben die Tickets online gebucht und hatten kein Problem in die Erlebniswelt und zu der Stadionführung zu gelangen.  Die Stadionführung ist sehr interessant und man bekommt einen sehr guten Eindruck von dem Stadion.  Die Erlebniswelt ist ebenfalls sehr interessant.  Man,50,"Osnabrück, Deutschland",
Erlebnisdatum: März 2019,Schönes Erlebnis,Auch als nicht Bayernfan ist die Erlebniswelt eine Reise wert. Man wandert durch die Geschichte des FC Bayern München. Am Besten verbindet man die Erlebniswelt mit einer Arena Tour.,50,,
Erlebnisdatum: Februar 2019,Super Sache für jeden Fan!,"Klasse Ausflugsziel für die ganze Familie! Mein Sohn (16 Jahre) hat sich den Ausflug gewünscht und ich muss sagen, dass es uns alles riesen Spaß gemacht hat.",50,"Wien, Österreich",
Erlebnisdatum: Januar 2019,Tolles Museum,"Wir waren vor dem Spiel in der Erlebniswelt. Auch als Nicht-Bayern-Fan lohnt sich der Besuch. Es gibt Fotoboxen, alle Spieler gibt es als Modelle. Viele Vitrinen mit Meisterschalen und Pokalen. Kostenloses WLAN vorhanden. Es sind immer mal wieder alte Bayernspieler da und",50,"Kornwestheim, Deutschland",
Erlebnisdatum: April 2019,Riesige Ausstellung,"Hier sieht man alles was den FC Bayern ausmacht. Beeindruckend die Pokale aber auch die vielen Videos. Die empfohlenen 1,5 Stunden für die Besichtigung reichen kaum aus",50,"Hinterzarten, Deutschland",Reiseart: mit Freunden
Erlebnisdatum: April 2019,Tolles Erlebnis ,"Wir haben die Tickets online gebucht und hatten kein Problem in die Erlebniswelt und zu der Stadionführung zu gelangen.Die Stadionführung ist sehr interessant und man bekommt einen sehr guten Eindruck von dem Stadion.Die Erlebniswelt ist ebenfalls sehr interessant.Man sieht hier sehr viele Pokale, Trikots und bekommt einen guten Eindruck über die Historie des Vereins.Sehr zu empfehlen.",50,"Osnabrück, Deutschland",Reiseart: mit der Familie
Erlebnisdatum: März 2019,Schönes Erlebnis,Auch als nicht Bayernfan ist die Erlebniswelt eine Reise wert. Man wandert durch die Geschichte des FC Bayern München. Am Besten verbindet man die Erlebniswelt mit einer Arena Tour.,50,,Reiseart: mit Freunden
Erlebnisdatum: Februar 2019,Super Sache für jeden Fan!,"Klasse Ausflugsziel für die ganze Familie! Mein Sohn (16 Jahre) hat sich den Ausflug gewünscht und ich muss sagen, dass es uns alles riesen Spaß gemacht hat.",50,"Wien, Österreich",Reiseart: mit der Familie
Erlebnisdatum: Januar 2019,Tolles Museum,"Wir waren vor dem Spiel in der Erlebniswelt. Auch als Nicht-Bayern-Fan lohnt sich der Besuch. Es gibt Fotoboxen, alle Spieler gibt es als Modelle. Viele Vitrinen mit Meisterschalen und Pokalen. Kostenloses WLAN vorhanden. Es sind immer mal wieder alte Bayernspieler da und schreiben Autogramme oder man Fotos machen. Besuch lohnt sich.",50,"Kornwestheim, Deutschland",Reiseart: mit Freunden
Erlebnisdatum: Januar 2019,Für FC Bayernfans ein must have seen!,"Wir waren zur Besichtigung der Allianz-Arena und der FC Bayern Erlebniswelt hier. Wir hatten ein Familien Kombiticket für 49,- Euro. Parken kostet ca 6,- Euro für 3 Std. Für Die Erlebniswelt soltte man sich ca. 1-2 Std. einplanen für die Tour nochmal eine Stunde. Für unser Sohn Fussballer und FCB. Fan war das einHighlight in München. Deshalb empfehlen wir das Ausflugsziel sehr gerne weiter!",50,"Queidersbach, Deutschland",Reiseart: mit der Familie
Erlebnisdatum: Januar 2019,FC Bayern Geschichte,"Gut gemachtes Museum, dass die Geschichte des FC Bayern und damit auch der Deutschen Bundesliga erzählt. Stars aus der Vergangenheit erzählen von den wichtigsten Erlebnissen beim Club und in einem Kino kann man sich die Highlights anschauen. Sehr interessant auch für Nicht-Fans.",50,"Frankfurt am Main, Deutschland",Reiseart: mit der Familie
Erlebnisdatum: November 2018,Imposant und teuer,"Die Besichtigung findet nur jede Stunde statt . Die Erlebniswelt ist eine Selbstbeweihräucherung, für die man auch noch zahlen soll.Das Bauerk ist eine architektonische Meisterleistung. Leider gibt es dazu weder Informationen. Noch nicht einmal eine Postkarte.",30,"Oldenburg, Deutschland",Reiseart: als Paar
Erlebnisdatum: Oktober 2018,Ein Teil der Geldmaschine FC Bayern München,"Erlebniswelten können auch anders sein. Familienfreundlich müssten sie allerdings alle sein. Aber das passt nicht zum FCB. Die vertreten Fußball-Weisheiten, die zur Einfachheit und Attraktivität des Fußballsports nicht passend sind. Mein Tipp: Fragen Sie mal bei der vereinsspitze nach, ob ""Spitzenfussball"" heißt, tief in die eigene Geldbörse zu greifen. Mein Tipp: Da gehe ich lieber in den Englischen Garten...",30,"München, Deutschland",Reiseart: mit der Familie
Erlebnisdatum: Oktober 2018,Selbstbeweihräucherung,"War im Rahmen der langen Nacht der Museen da, weil ich es nicht einsehe, 49 € Eintritt zu zahlen. Pardon: das gilt natürlich nur an Spieltagen, wenn man eine gültige Eintrittskarte hat. Sonst ist es ja geschlossen.Um es kurz zu machen: in dieser Schau präsentiert der FC Bayern sich, seine Erfolge, seine Helden und so manche Kuriosität. Was der Verein da in fast 120 Jahren erreicht hat, ist aller Ehren wert.Respektlos hingegen ist die winzige Nische am Ausgang für den Frauenfußball, die Basketball-Abteilung und ""sonstige Sportarten"". Dann lieber ganz weglassen, als vielfache Deutsche Meister so abzuspeisen.Fazit: Da ich bereits im DFB-Museum und einigen anderen war, ist es für mich ein Fußball-Museum wie jedes andere. Kann man sich ansehen, muss man aber nicht. Für 49€ p.P. eher nicht.",30,"Bayern, Deutschland",Reiseart: als Paar
Erlebnisdatum: August 2018,Unglaublich viel zu sehen.,Hier bekommt man gute Einblicke in die Geschichte des Clubs und das zu Hauf. Man kann sich hier sehr lange aufhalten und es wird einem definitiv nicht langweilig.,50,"Neufahrn bei Freising, Deutschland",Reiseart: als Paar
Erlebnisdatum: April 2018,Absolut toll!,"Der Besuch in der FC Bayern Erlebniswelt war der absolute Hammer. Es gibt so viel zu sehen. Alle Momente und die komplette Geschichte des FC Bayern ist mit ganz vielen Gegenständen dargestellt. Man bekommt eine richtig tiefen Einblick und fühlt so richtig mit. Im Anschluß kann man sogar sein personalisierte Urkunde mit Bild abholen. Der Bayern Shop im Anschluss ist ebenfalls toll gemacht, hier kann man dann nochmal sein Geld lassen. In Kombination mit einem Besuch der Arena absolut toll!",50,"Wiesloch, Deutschland",Reiseart: mit der Familie
Erlebnisdatum: August 2018,Ein Muss für den Fan,"Hier sollte jeder gewesen sein, der ein Fan des FCB ist. Da gibt es tolle Sachen und viele schöne Erinnerungen!",50,BaWü,Reiseart: als Paar
Erlebnisdatum: August 2017,Tolle Historie,"Nachdem ich mein erstes Heimspiel der Bayern erlebt habe, hatte ich noch eine Stadiontour durchgeführt inkl. Museumsbesuch und es ist toll zu sehen wie der FCB im Laufe der letzten 60 Jahren zu einem Weltverein aufgestiegen ist",50,"Olten, Schweiz",Reiseart: mit Freunden
Erlebnisdatum: Juli 2018,viel zu teuer,Eigentlich wollten wir nur einen kurzen Blick ins Stadion werfen. Aber ohne Eintritt nirgends möglich. Da ist das HSV-Stadium schon freundlicher. Preise für Getränke sehr hoch.,20,,Reiseart: als Paar
Erlebnisdatum: Juni 2018,Top,Wenn man schon die Arena besucht ist die angeschlosse Erlebniswelt ein Pflichtbesuch. Alle Erfolge sind dort vertreten.,50,,Reiseart: geschäftlich
Erlebnisdatum: Mai 2018,Soooo viele Erinnerungen,"Der Vorsatz nur schnell mal durchlaufen hält nicht lange. So viel Interessantes lebendig aufbereitet. Mehr als einmal ""ah, da kann ich mich doch noch erinnern"", ""oh wie schön war das"" usw. Ein Besuch lohnt sich!",50,"Weil am Rhein, Deutschland",Reiseart: als Paar
Erlebnisdatum: April 2018,Erlebniswelt - der Name stimmt,Wir hatten einen schönen Tag in der Erlebniswelt und auch die Stadiontour war sehr gut gemacht. In anderen Stadien darf man nicht den Bereich der Heimmannschaft aber in München war es anders. Tiefe Einblicke in den Verein und Arena.Preis und Leistung stimmen hier.Gerne wieder!!!,50,"Lauenförde, Deutschland",Reiseart: mit der Familie
Erlebnisdatum: März 2018,Verein der Vereine:,"Der FC-Bayern München wurde 1900 gegründet, vor jetzt 118 Jahren. Übrigens auch durch den Flugzeugpionier Wilhelm Focke. - Der FC Bayern-München gehört zu München wie die Frauenkirche.",50,"Berlin, Deutschland",Reiseart: geschäftlich
Erlebnisdatum: März 2018,Hervorragend!,"Zum ersten Mal besuchten wir die FCB-Erlebniswelt im Rahmen eines Wochenendaufenthaltes in München. Zufällig wurde an unserem Besuchstag eine Sonderausstellung mit einer Feier verlängert. Hier war auch der überaus beliebte Spieler Giovane Elber anwesend um ein Interview und Autogramme zu geben. Dies allein war schon ein Erlebnis.Meine Frau, die sich aus Fußball überhaupt nichts macht, war ebenfalls sehr angetan von der Erlebniswelt und von der Veranstaltung.Ein tolles Erlebnis, nicht nur für die Fans des FC Bayern München, sondern auch für jeden Fußballfan. Der FC Bayern München hat mit seiner Erlebniswelt eine Einrichtung geschaffen, die sogar für Leute interessant ist, die mit Fußball wenig am Hut haben.Die Erlebniswelt und die Allianz Arena sind immer einen Besuch wert.",40,"Steinwiesen, Deutschland",Reiseart: als Paar
Erlebnisdatum: April 2017,Super,"Absoluter Muss für jeden Bayernfan. Ist immer sehr gut besucht. Viele Touristen, manchmal etwas stressig",50,"Kehlen, Luxemburg",
Erlebnisdatum: Februar 2018,sehr geniale Ausstellung,"Obwohl ich mit Fusball nichts an Hut habe, kann ich einen Besuch der""FC Bayern Erlebniswelt"" absolut empfehlen.Wirklich toll gemacht und Sehr Sehenswert.",50,"Neunkirchen, Deutschland",Reiseart: als Paar
Erlebnisdatum: Januar 2018,großartiges Museum!,"Was für ein tolles Museum! Sogar als nicht FC B-Fan muss ich neidlos anerkennen, dass hier für die Besucher ein umwerfender Erlebnisparkour erstellt worden. Die gesamte Geschichte samt Erfolgen des FC B wir sehr ansehnlich und spannen dokumentiert.Mit 1,5 Stunden hatten wir insgesamt zu wenig Zeit, eine Stunde mehr wäre gut gewesen.Wer Zeit bei seinem Münchenbesuch hat und Interesse am Fussball hat, sollte sich diese Erlebnis nicht entgehen lassen!",50,"Hamburg, Deutschland",Reiseart: mit der Familie
Erlebnisdatum: Januar 2018,"Super Museum, aber falscher Verein","Wäre schön, wenn Kaiserslautern auch so einen Laden hätte. Aber auch als Freund und nicht gerade Fan der Bayern sehr beeindruckend!",40,,Reiseart: allein
Erlebnisdatum: Januar 2018,Für jeden Bayern Fan ein Muss,"Wer zum ersten Mal in der FC Bayern Erlebniswelt ist, sollte sich wirklich Zeit nehmen um in die Geschichte des besten Fußball Vereins der Welt einzutauchen. Wir haben uns Zeit gelassen und waren drei Stunden vor Ort. Von den Anfängen bis heute wird auf alle Jahrzehnte tiefgründig eingegangen. Es gibt Replikate jedes einzelnen vom FCB gewonnenen Titel zu bewundern. Highlights waren für mich die Sonderausstellung 'Momente', da ich auch insbesondere bei einigen dabei sein durfte, die Hall of Fame mit allen FCB Spielern und die Trikotwand. Es ist einfach interessant nochmal gebündelt zu sehen, wer bereits alles Teil dieses wunderbaren Vereins war. Außerdem wird auch auf die Entwicklung des Fußballs im Allgemeinen eingegangen z.B. anhand der Bälle, der Fußballschuhe, der Stadien und auch der Medien. Es gibt so viel zu entdecken und die ganzen Exponate machen es wirklich zu etwas Besonderem. Ständig startet auch irgendwo kleine Filmchen und lassen einen gerade aus Frühen Jahren an Spielen und besonderen Ereignissen teilhaben, die man so noch nicht kannte oder es blühen Erinnerungen auf wie z.B. an die berühmte Rede von Trapattoni. Selbst nicht Bayern Fans können hier die Geschichte des Fußballs mit erleben. Ich komme gerne wieder! Und vergesst nicht den Fotoapparat oder das Handy aufzuladen um fleißig Bilder zu machen. Gerade Fotos am Schluss mit den aktuellen Spielern in Lebensgröße dürfen nicht fehlen. Ich wünsche viel Spaß!",50,"München, Deutschland",Reiseart: als Paar
Erlebnisdatum: Januar 2018,Empfehlung!,"Wer ein echter Bayernfan ist , muss das gesehen haben. Die ganze Geschichte von Bayern toll ausgestellt bis heute alles nachzuverfolgen. Muss man gesehen haben! Fan Shop integriert!",50,"München, Deutschland",Reiseart: mit der Familie
Erlebnisdatum: November 2017,Lange Wege,Im Vergleich zum Estadio Santiago Bernabéu Stadion in Madrid zeigt sich die Erlebniswelt des FC Bayern nur als zweitklassig. Lange Wege und wenig Spannungsvolles Erleben. Da läßt sich noch einiges Verbessern.,30,"München, Deutschland",Reiseart: geschäftlich
Erlebnisdatum: November 2017,Weltklasse,"Auf Einladung des FC Bayern (ich hatte ein Exponat zur Verfügung gestellt) war ich mit meiner Frau in der Erlebniswelt. Für mich als ewigen Fan des FCB war es wie im Spielzeugladen. Alles, wirklich alles war toll arrangiert, besonders die Sonderausstellung ""FC Bayern Momente"" hatte es mir angetan, weil dort MEIN Foto zu sehen war. Aber auch die gesamte Geschichte des Vereins, von der ersten Meisterschaft 1932, das ""Triple"" 2013, sämtliche Pokale, begleitet von Bild und Ton, spannende Quizfragen auf interaktiven Bildschirmen, Fussballherz, was willst Du mehr?! Für die Kleinen gibt es ein Holzhaus (Bewohner ist Bernie, das Maskottchen), ein rundum gelungenes Museum, vollgestopft mit Erinnerungen.",50,"München, Deutschland",Reiseart: als Paar
Erlebnisdatum: November 2017,Tolles Vereinsmuseum,"Die Bayern Erlebniswelt ist ein tolles Vereinsmuseum und für nicht Fußballfans auch sehr interessant.  Hier bekommt man einen tollen Einblick im die Geschichte und Entwicklung dieses Vereins.  Man sollte sich hierfür auch ausreichend Zeit nehmen.  Eine Verbindung mit einer Stadion-Tour ist sehr zu empfehlen!!  Vor der Arena gibt es an spielfreien Tagen ausreichend Parkplätze.Die Erlebniswelt mündet dann direkt in den Megastore mit allen Artikeln was ein Fußballer-Herz begehrt.  Nachteilig ist nur die Garderobe angelegt.  Man muss durch die gesamte Erlebniswelt wieder retour,  um am seine Sachen zu kommen.  Tickets (speziell für die Stadion-Tour) sollte man unbedingt im voraus via Internet kaufen.  Es gibt zwar alle 15 Minuten eine Tour,  allerdings ist auch der Besucherandrang dementsprechend.  In Summe aber ein absolutes Highlight und sehr zu empfehlen!",40,,Reiseart: mit der Familie
Erlebnisdatum: November 2017,Man muß Bayern-Fan sein,"Als Fan von Bayern München ist die Erlebniswelt durchaus empfehlenswert, da die Geschichte des Vereins dargestellt wird.",40,"Düsseldorf, Deutschland",Reiseart: mit der Familie
Erlebnisdatum: September 2016,Pflichtbesuch für einen Bayern-Fan,"Ein Besuch der authentischen FCB - Erlebniswelt ist für einen Bayern-Fan ein echtes Muss. Tolle Ausstellung, bei der die Infos über den FC Bayern abwechslungsreich dargestellt werden. Extrem kurzweilig. Allgemein macht das Museum auch einen sehr sauberen Eindruck. Preislich mit",40,"Ingolstadt, Deutschland",
Erlebnisdatum: August 2017,Gut gemacht,"Super mit den öffentlichen Verkehrsmitteln zu erreichen. Toll gemacht, sehr informativ auch interessant wenn man nicht der größte Fussballfan ist. Die Sonderaustellungen sind sehr gut gemacht, alles gut erläutert, viel zu bestaunen für jung und alt. Spielewelt und Bolzplatz für",40,"Baden-Württemberg, Deutschland",
Erlebnisdatum: Oktober 2016,Ein muss für jeden Bayern Fan,Muss man als Fan einfach einmal gesehen haben. Am besten gleich in Kombination mit einer Besichtigung der Arena. ,50,"Blindheim, Deutschland",
Erlebnisdatum: Juli 2017,Sehr empfehlenswert!!,Die Führung durch das Wohnzimmer des FC Bayern lohnt sich absolut. Insbesondere die Bayernkabine und der unterirdische Spielerzugang zur Arena sind Highlights!!,40,Deutschland,
Erlebnisdatum: Juni 2017,Topptipp für Fußballfans,"Auch wenn man kein Bayern München Fan ist, kann man den Besuch der Bayern München Erlebniswelt nur empfehlen. Eine tolle Sammlung von Trophäen kombiniert mit einer interaktiven Präsentation der Geschichte von Bayern München. Gut erreichbar mit der U Bahn (Station Fröttmaning) ",50,"Wien, Österreich",
Erlebnisdatum: September 2016,Pflichtbesuch für einen Bayern-Fan,"Ein Besuch der authentischen FCB - Erlebniswelt ist für einen Bayern-Fan ein echtes Muss. Tolle Ausstellung, bei der die Infos über den FC Bayern abwechslungsreich dargestellt werden. Extrem kurzweilig. Allgemein macht das Museum auch einen sehr sauberen Eindruck. Preislich mit 10€ für Mitglieder und 12€ für Nicht-Mitglieder noch in Ordnung (Nur Museum). Zu erreichen ist es direkt von der Autobahn.  Am besten im P+R Fröttmaning parken und einen kleinen Spaziergang zum Stadion machen.",40,"Ingolstadt, Deutschland",Reiseart: als Paar
Erlebnisdatum: August 2017,Gut gemacht,"Super mit den öffentlichen Verkehrsmitteln zu erreichen.Toll gemacht, sehr informativ auch interessant wenn man nicht der größte Fussballfan ist.Die Sonderaustellungen sind sehr gut gemacht, alles gut erläutert, viel zu bestaunen für jung und alt.Spielewelt und Bolzplatz für die Kleinen.Saubere Toiletten. Raffiniert gemacht, dass die Erlebniswelt in dem größten Bayernshop endet ;-)",40,"Baden-Württemberg, Deutschland",Reiseart: mit der Familie
Erlebnisdatum: Oktober 2016,Ein muss für jeden Bayern Fan,Muss man als Fan einfach einmal gesehen haben. Am besten gleich in Kombination mit einer Besichtigung der Arena.,50,"Blindheim, Deutschland",
Erlebnisdatum: Juli 2017,Sehr empfehlenswert!!,Die Führung durch das Wohnzimmer des FC Bayern lohnt sich absolut. Insbesondere die Bayernkabine und der unterirdische Spielerzugang zur Arena sind Highlights!!,40,Deutschland,Reiseart: mit Freunden
Erlebnisdatum: Juni 2017,Topptipp für Fußballfans,"Auch wenn man kein Bayern München Fan ist, kann man den Besuch der Bayern München Erlebniswelt nur empfehlen. Eine tolle Sammlung von Trophäen kombiniert mit einer interaktiven Präsentation der Geschichte von Bayern München. Gut erreichbar mit der U Bahn (Station Fröttmaning)",50,"Wien, Österreich",Reiseart: als Paar
Erlebnisdatum: Juni 2017,empfehlenswert...,"für den geneigten Fussballinteressierten, auch wenn er kein Bayernfan ist. Sehr schön aufbereitete Geschichte des FCB mit tollen Exponaten.",40,"Marchtrenk, Österreich",Reiseart: mit der Familie
Erlebnisdatum: Juni 2017,"Regelmäßig ein ""Muss"" für jeden FC Bayern-Fan!","Immer wieder schön und ehrwürdig, der FCB Erlebniswelt einen Besuch abzustatten, die wechselnden Sonderausstellungen (zuletzt ""Fussballprofi - Traum und Wirklichkeit"") zu besuchen und anschließend im FCB Megastore zu stöbern!",50,"München, Deutschland",Reiseart: mit der Familie
Erlebnisdatum: Mai 2017,Interessant und spannend,"Unser Sohn wollte gerne die Allianz Arena besuchen. Wir nahmen dabei an der Führung durch die ganze Arena teil (sehr empfehlenswert). Dabei durften wir dann mit diesem Ticket auch in die Erlebniswelt, wo man viel über den FC Bayern seit Gründung bis jetzt erfuhr.",50,"Thalwil, Schweiz",Reiseart: mit der Familie
Erlebnisdatum: Dezember 2016,Toller Ausflug für Fußballer,"die Bayern Welt überzeugt durch ein tolles Konzept: Wissen, Aktion, Spass und FC Bayern Emotion pur. Für Kid's super und auch für erwachsene Bayern Fans sehr sehr schön gemacht.",50,"Neustadt an der Weinstraße, Deutschland",Reiseart: mit der Familie
Erlebnisdatum: Mai 2017,willkommens-text auf der eintrittskarte passt nicht zur realität:,"der tourstart war mit 9:00 uhr festgelegt, die aus-schilderung am stadion ist zwar vorhanden jedoch mehr als mangelhaft, der willkommenstext suggeriert eine ankunft beim treffen in ebene 3. biershop 15 minuten vor beginn der führung. ja ... was soll ich sagen ... niemand vor ort, am ost-eingang standen zwei park-haus-wächter welche die öffnungs-uhrzeit mit frühestens 10 uhr definierten, kein verantwortlicher erreichbar für gebuchte  ""VIP-Tour"",  und weder einlass wurde gewährt noch auskunft erteilt. zur ebene 3 kommt man grundsätzlich nur wenn man am tor 62-64 denn eingelassen wird. alles andere ist makkulatur.  die hälfte der gruppe verabschiedete sich vor geschlossenen toren bevor die tour begann.  für die andere hälfte fand die tour dann tatsächlich statt.  alles in allem:   ziemlich durchwachsen würde ich sagen. korrigiert den text auf der karte in eine aussage die man versteht: am tor 62  warten bis jemand kommt. wenn nicht, dann unverrichteter dinge eben wieder nach hause gehen.! keine logistische meisterleistung diese erlebniswelt .!",20,"Visp, Schweiz",Reiseart: geschäftlich
Erlebnisdatum: Juni 2016,Immer ein Ausflug wert!,"Wer was über die Geschichte von Bayern München erleben will, sollte das hier nicht verpassen. Ist Pflicht!",40,"München, Deutschland",Reiseart: als Paar
Erlebnisdatum: Mai 2017,Für Bayern-Fans ein Muß!,"Einfach toll, wie hier die Entwicklung des Vereins dargestellt wird. Alles wirklich sehr beeindruckend, insbesondere natürlich die Trophäensammlung. Auch der 12-minütige Film über den CB ist sehr sehenswert.",50,"Magdeburg, Deutschland",Reiseart: mit der Familie
Erlebnisdatum: September 2016,Für ein Bayern Fan ein muss,Also ein echter Bayern Fan der in München ist muss dahin.Hier findet er mit Sicherheit das eine oder andere was auch er noch nicht zuvor wusste,40,,Reiseart: als Paar
Erlebnisdatum: April 2017,Tolle Geschichte,Wer sich für die Geschichte des FC Bayern München interssiert ist hier sehr gut aufgehoben. Von der Gründung des Vereins bis hin zur letzten errungenen Meisterschaft ist jedes Ereignis beschrieben.,50,"Leingarten, Deutschland",
Erlebnisdatum: April 2017,Viel zu sehen auch wenn man kein Fan ist,"Das Museum ist interessant gestaltet,es gibt viel zu sehen und zu lesen,interessante Videos ohne Ende. 90 min sollte man mindestens einplanen.",40,,Reiseart: als Paar
Erlebnisdatum: September 2016,Mir san mir,"Muss für jeden Bayern Fan , hier kann man sich Komplet einkleiden. Außerdem Nudeln Kartoffel Hausrat alles Bayern.",50,"Bad Windsheim, Bayern, Germany",Reiseart: als Paar
Erlebnisdatum: Februar 2017,Immer wieder ein Besuch wert - auch wenn kein Bayern-Fan,"Unglaublich tolle Infos aus der Vergangenheit, auch von den Anfängen....  Spannend auch für NICHT-Bayern-Fans",40,"Gilching, Deutschland",Reiseart: mit Freunden
Erlebnisdatum: Dezember 2016,Gut gemacht,Ein Muss für jeden Bayern Fan. Unser Guide war sehr gut drauf. Selbst wenn man in München wohnt ist das eine tolle Sache!,50,"Frankfurt am Main, Deutschland",Reiseart: mit der Familie
Erlebnisdatum: August 2016,Alles FC,"Wenn man FCB Fan ist ist alles gut und man ist begeistert. Shoppen kann man alles, wo FCB draufsteht.",30,"Nürnberg, Deutschland",
Erlebnisdatum: August 2016,Ein Muss für jeden Bayernfan!,Eine schöne Ausstellung bzw. Darstellung sämtlicher Erfolge und der Geschichte des FC Bayern. Zusammen mit einer Führung durch die Allianzarena ein gelungener Ausflug!,50,,Reiseart: mit der Familie
Erlebnisdatum: April 2016,Klasse auch als Sechziger Fan,Waren bei der Führung auch in der Sechziger Kabine nur weil ich Fan bin klasse. bei der Größe des Stadions  kann man wirklich fast alles sehen und hören,50,"München, Deutschland",Reiseart: mit Freunden
Erlebnisdatum: Januar 2017,zu wenig Zeit,"Wir waren am 08.01.2017 im Zuge einer Stadionfühung in der FCB Erlebniswelt. Leider hatten wir nur etwas über eine Stunde Zeit das wir unseren Zug erreichen mussten. Es empfiehlt sich als FC Bayern Sympathisant deutlich mehr als eine Stunde einzuplanen. Ansonsten schöne Ausstellungstücke welche auch mit dem Audioguide super beschrieben wurden. Wir wollten uns auch noch das angebotene Kino ansehen, dieses startete jedoch nicht zum angegebenen Zeitpunkt somit mussten wir es auslassen. Personal sehr freundlich und hilfsbereit.",40,,Reiseart: als Paar
Erlebnisdatum: Januar 2017,Tolles Erlebnis,"Einfach Klasse, den Weg des FC Bayern und seiner Stars mit zu verfolgen. Besonders für Kinder, die Fußball spielen, interessant.",50,"Samerberg, Deutschland",Reiseart: als Paar
